Company_Id,title,publish date
1,"How the retail industry will top $5.5 trillion by 2020 (TGT, WMT, AMZN)",10/31/19
1,Over 200 musicians have pledged to boycott Amazon's music festival unless the company severs all ties with ICE (AMZN),10/24/19
1,"I spent the last week with Amazon's new Echo Buds, and it showed me a lot about where Alexa is going (AMZN)",10/29/19
1,Toy brands are reportedly paying Amazon millions of dollars for the chance to be featured in its annual holiday gift guide (AMZN),10/21/19
1,"Trump reportedly tried to stop Amazon from winning a $10 billion cloud deal, but experts say Microsoft won on its own merits (AMZN, MSFT)",10/29/19
1,"Microsoft and Amazon are showing slowdowns in their all-important cloud businesses — but Wall Street says there's far more to the story (AMZN, MSFT)",10/25/19
1,"It looks like Amazon is moving into a massive new tower that the late Microsoft cofounder Paul Allen's company is building in the Seattle suburb where Jeff Bezos started it all (AMZN, MSFT)",10/30/19
1,"Microsoft's $10 billion Pentagon cloud contract win is a clear sign it's in the same league as Amazon Web Services, but experts say the fight isn't finished yet (MSFT, AMZN)",10/29/19
1,Amazon.com Inc (AMZN) Q3 2019 Earnings Call Transcript,10/24/19
1,Amazon.com announces third quarter sales up 24% to $70.0 billion (Amazon),10/24/19
1,The Number One: FAANG companies’ employees donate most often to this presidential candidate,10/31/19
1,Microsoft’s Challenge of Amazon in the Cloud Gains Force - The Wall Street Journal,10/27/19
1,"Dow Jones Turns Lower Amid China News, As This Blue Chip Sells Off 5% - Investor's Business Daily",10/21/19
1,Banks are at risk of losing $88 billion in payments revenue due to tech competition,10/23/19
1,"Dow Jones Today: Intel, Cat Boost Dow; Amazon Bites Nasdaq - Investor's Business Daily",10/25/19
1,亚马逊第三季度净利润21.34亿美元 同比下降26%,10/24/19
1,Amazonが『Echo Dot』とAmazon Music Unlimited1ヶ月で999円キャンペーン開催中!,10/27/19
1,This chart shows how much Brexit matters to the U.S. stock market,10/17/19
1,Twice as many copies of the Constitution have sold during Trump’s presidency as during Obama’s first term,10/15/19
1,Netflix to sell another $2 billion of junk bonds as it braces for onslaught of competition,10/21/19
1,The Ratings Game: Microsoft wins JEDI battle but Amazon could return fire,10/28/19
1,"Momentum investors are now buying shares of Apple, Amazon and Netflix",10/15/19
1,Meg Whitman’s new venture is thinking big with a short-form streaming service,10/22/19
1,Amazon eliminating the $14.99 fee for grocery delivery to Prime members,10/29/19
1,Amazon: A Lot To Like Here,10/28/19
1,Amazon won't spin off AWS. That's hurting AWS,10/28/19
1,"Tech Roundup: AMZN Misses, MSFT Tops, INTC Is the Biggest Surprise - Yahoo Finance",10/25/19
1,Democrat Presidential Candidates Clash Over Breaking up Big Tech - TheStreet.com,10/16/19
1,"Amazon Linux AMI Install Linux, nginx, MySQL, PHP (LEMP)",10/15/19
1,Amazon Earnings Miss Countered By Solid Results Across the Board,10/25/19
1,Amazon (AMZN) Q3 Earnings Lag Estimates,10/24/19
1,"Amazon -7.5% on Q3 profit miss, light holiday sales forecast - Seeking Alpha",10/24/19
1,Will Amazon's (AMZN) Q3 Earnings Benefit From Prime & AWS?,10/21/19
1,One-Day Shipping Pain Worth It For Amazon's Long-Term Gain,10/25/19
1,The Ratings Game: Chip-equipment companies suggest a recovery is on the way,10/31/19
1,Outside the Box: Here’s what to watch in the Microsoft vs. Amazon cloud battle after JEDI win,10/28/19
1,How to buy toys for the kid who has everything — without relying on sponsored lists from Amazon or Walmart,10/21/19
1,The Margin: Americans are spending almost half a billion on Halloween costumes for their pets,10/22/19
1,"Amazon (AMZN) Q3 Earnings Miss, Revenues Beat Estimates",10/25/19
1,Should You Buy Amazon ETFs Ahead of Q3 Earnings?,10/22/19
1,Howard Gold's No-Nonsense Investing: Wall Street is way too paranoid about a President Elizabeth Warren,10/29/19
1,"Amazon AWS Selected by Old Mutual, Expands Cloud Clientele",10/18/19
1,"Marijuana stocks, after declines of over 50%, are now only ludicrously overpriced",10/16/19
1,"The Force Is With Microsoft; Apple Might Be Cooked For Now, Let's Chart It",10/27/19
1,"E-commerce Stocks' Q3 Earnings Roster: AMZN, EXPE, MELI & W",10/23/19
1,"Q3 Earnings Frenzy: Amazon (AMZN), Intel (INTC) & More",10/24/19
1,"Amazon (AMZN) Q3 2019 Earnings Preview: AWS, Prime & Advertising",10/16/19
1,Amazon (AMZN) Earnings Thursday Could Be a Springboard,10/23/19
1,Microsoft’s Break Out May Send Shares Surging Higher,10/28/19
1,Amazon (AMZN) Reports Q3 Earnings Today: Will It Top or Flop?,10/24/19
1,Jeff Bezos Could Lose Title Of World's Richest Person After Amazon's Earnings Miss,10/25/19
1,"Amazon (AMZN) Stock’s Profit Crash Hurts, But It Paves the Way for Next Surge",10/25/19
1,"November Outlook: From Jobs To Fed To China, This Month Has It All",10/30/19
1,"Earnings Get Even Busier As More Than 40 Companies Report Today, Including Amazon",10/24/19
1,The total market index isn’t all it’s cracked up to be,10/21/19
1,"Earnings Watch: Tesla speeds toward unpleasant earnings turn, Boeing faces tough questions",10/20/19
1,CEIVA Logic Sues Amazon for Patent Infringement,10/23/19
1,JR東日本、北陸新幹線の水没にも動ぜず,10/15/19
1,"Sustainable Investing: For ESG investors, the newest challenge is separating fact from ‘greenwashing’",10/15/19
1,This shocking stat will make you want to buy Amazon stock after its recent beatdown,10/25/19
1,Amazon Offering Big Shippers Customized Ground Delivery Services At Low Rates,10/28/19
1,Microsoft Stock Poised To Break Out On JEDI Contract Win - Investor's Business Daily,10/28/19
1,"The 'Empire Strikes Back'; Why FANG Isn't Leading, And What It Can Do Right Now",10/18/19
1,Ações da Apple batem novo recorde; Alphabet passa Amazon e se torna a 3ª empresa mais valiosa,10/23/19
1,"Aukey Handyhalterung mit Saugnapf, 360° drehbar (Prime)",10/22/19
1,Tech Stocks Drive the S&P 500 to Record Highs - Market Realist,10/29/19
1,5 Amazing Big Tech Earnings Charts - Zacks.com,10/22/19
1,"Breakup of Tech Giants ‘on the Table,’ U.S. Antitrust Chief Says - Wall Street Journal",10/22/19
1,I Bought Amazon Stock Today — And You Should Too,10/25/19
1,"Jim Cramer Shares His Thoughts On Canopy Growth, Procter & Gamble And More",10/17/19
1,"We're Just Points From An S&P Breakout, And Strong Results From Microsoft, ServiceNow, And PayPal Will Boost Cloud Names",10/24/19
1,Is Amazon Stock Ready to Break Out Again?,10/15/19
1,Here's Why Investors Will Pay Attention to Amazon's Holiday Predictions This Week,10/24/19
1,"Jeff Bezos plays hooky, goes back to school - Fox Business",10/21/19
1,Microsoft Just Won a $10 Billion Defense Cloud Contract,10/28/19
1,Warren and Biden Attack Facebook's Most Successful Business - Market Realist,10/15/19
1,Boot Barn (BOOT) and Burlington Stores (BURL) Are Aggressive Growth Stocks,10/17/19
1,Etsy Is Beating Amazon At Its Own Retailing Game,10/24/19
1,5 Amazing Big Tech Earnings Charts,10/22/19
1,Apple supera Microsoft é mais uma vez a empresa mais valiosa do mundo,10/19/19
1,Amazon Drops on Wide Earnings and Guidance Miss; Revenue Tops Estimates - TheStreet.com,10/24/19
1,Survey: Teens Spend More Time On YouTube Than Netflix,10/15/19
1,Roku Shares Advance After Streaming-Tech Company Adds Apple TV - TheStreet.com,10/15/19
1,"Big Tech Antitrust Is Bipartisan, Says Antitrust Chief Makan Delrahim - Barron's",10/22/19
1,"Eurozone Fears, CAT, MSFT & TSLA Earnings & Buy Callaway Stock - Free Lunch",10/24/19
1,"Undeserved: Alphabet, Shopify; Unforgiven: Grubhub, Beyond Meat",10/29/19
1,5 Amazing Big Tech Earnings Charts - Nasdaq,10/22/19
1,One Winter Night 2019 720p AMZN WEBRip x264-KamiKaze,10/30/19
1,The Circus S04E14 720p AMZN WEB-DL H264-monkee,10/29/19
1,Lobbying spending by tech giants set to hit record highs - Fox Business,10/28/19
1,Amazon experiments with travel benefit for employee health care - Fox Business,10/15/19
1,Google's Nest Business Is Losing Key Customers—What's Next? - Market Realist,10/22/19
1,Spotify Earnings Surprise As Subscriber Growth Tops Views - Investor's Business Daily,10/28/19
1,"BUD, AMZN among premarket losers",10/25/19
1,Lot Lizard 2016 1080p AMZN WEBRip x264-NTb,10/29/19
1,Baby Baby Baby 2015 1080p AMZN WEBRip x264-ABM,10/31/19
1,麥肯錫：全球逾半數銀行無法承受經濟衰退 - 鉅亨網財經新聞,10/22/19
1,Betting On Tomorrow: Introducing Premium Tech Research,10/28/19
1,Naspers Spinoff Wades Into U.K. Food Delivery Fight,10/24/19
1,"Amazon, Twitter, Intel earnings — What to know in markets Thursday",10/23/19
2,Cisco Systems (CSCO) Outpaces Stock Market Gains: What You Should Know,10/21/19
2,"Cisco Closes CloudCherry Buyout, Boosts Customer Experience",10/15/19
2,"John Chambers and a star team of ex-Cisco engineers have finally launched Pensando Systems, a startup with $278 million in funding, to take on Amazon — and Cisco (CSCO)",10/17/19
2,【不労所得】配当金7000円を米国株シスコシステムズからゲット！ - ”もみあげ”の米国株投資-お金で幸せになる！-,10/26/19
2,"Barron's Picks And Pans: Boeing, Comcast, Conoco, Emerson And More",10/20/19
2,Tech Stocks for Dividend Investors to Buy as Q3 Earnings Season Heats Up,10/16/19
2,Apple shares hit new all-time intraday and closing highs,10/23/19
2,Apple shares hit new all-time intraday and closing highs,10/28/19
2,Apple shares hit new all-time intraday and closing highs,10/21/19
2,Apple shares hit new all-time intraday and closing highs,10/24/19
2,Apple shares hit new all-time intraday and closing highs,10/25/19
2,Apple shares hit new all-time intraday high,10/22/19
2,3 Top High-Yield Tech Stocks,10/30/19
2,Big Tech Stakes Equal Big Risk - Morningstar.com,10/21/19
2,Trying to Find Value in Tech Companies That Have Gone Public in 2019: Slack Technologies - Yahoo Finance,10/29/19
2,"The Zacks Analyst Blog Highlights: Verizon, Microsoft and Cisco Systems",10/17/19
2,6 Stocks to Buy for Their Massive Stock Buybacks,10/30/19
2,"Merger Arbitrage Mondays - 7 Deals Close, With Few New Ones In Sight",10/15/19
2,Merger Arbitrage Mondays - Alexion's Acquisition Of Achillion Includes A Free Kicker,10/22/19
2,美股盤後 — 波音、嬌生暴跌夾擊 道瓊下跌逾250點 - http://house.cnyes.com/global/index_all_news.aspx,10/18/19
2,5 Top-Ranked Cheap Stocks Trading Under $20 to Buy Right Now,10/30/19
2,Readers' Call: Good Dogs And Rogues September 13-October 11,10/17/19
2,"The SaaS Correction Isn't Done, But Names Like Alteryx Can Be Bought Already",10/21/19
2,"Zoom: Great Company, Valuation Still In Fantasy Land",10/22/19
2,20 Large-Cap Dividend Stocks With More Cash Than Debt,10/25/19
2,Merger Arbitrage Mondays - Pacific Biosciences Drops After U.K.'s Competition And Markets Authority Raises Concerns,10/30/19
2,米国株（アメリカ株）の高配当銘柄ランキングTOP10！アップルの配当、「ダウの犬」投資法とは？,10/28/19
2,Our SaaS Picks: Playing Defense In The Software Space,10/25/19
2,Datadog - Something Special And Worth A Gamble,10/30/19
2,Cisco Schedules Conference Call for Q1 Fiscal Year 2020 Financial Results,10/30/19
2,Cisco Powering KDDI's Network Refresh for 5G,10/21/19
2,Les chrétiens oubliés en Syrie,10/18/19
2,Cisco Nominates Carol B. Tomé to Board of Directors,10/17/19
2,Cisco Strengthens Partnership with Telenor on 5G in Norway,10/21/19
2,Cisco Deploys Intent-Based Networking Technology into the Telefonica,10/21/19
2,"Ex-Cisco CEO John Chambers, star team of engineers have a startup targeting Amazon’s AWS",10/16/19
2,"Your first trade for Tuesday, October 29",10/29/19
2,"AppDynamics Delivers Latest App Attention Index Report, Revealing Emergence of The Era of the Digital Reflex",10/15/19
2,Dynatrace: The Transition Period Provides The Opportunity,10/28/19
2,City Football Group Announces New Global Partnership With Cisco,10/17/19
2,"Your first trade for Friday, October 25",10/25/19
2,"Your first trade for Thursday, October 17",10/17/19
2,"Your first trade for Wednesday, October 16",10/16/19
2,How To Retire With Just Half A Million,10/26/19
2,"10 ""Autopay"" Dividend Stock Picks to Subscribe To",10/30/19
2,От санкций на полном ходу,10/22/19
2,Better buy: Cisco Systems vs. Microsoft,10/17/19
2,"Your first trade for Tuesday, October 22",10/22/19
2,Hollywood Park Partners With Cisco To Create World-Class Technology Showcase,10/31/19
2,Micron: Watch For Big Upside In Server Growth From Customers This Quarter,10/18/19
2,China Decoupling Puts The QQQ At Risk,10/24/19
2,Best Dividend Stocks for November 2019,10/30/19
2,Mad Dogs Of The Dow - The Outperformance Increases,10/15/19
2,Digital Ad Spending Projected to Finally Surpass Offline Spending This Year,10/17/19
2,Cisco Schedules Conference Call for Q1 Fiscal Year 2020 Financial Results,10/30/19
2,5 Best CEFs To Buy For October 2019,10/19/19
2,Pagerduty: The Only Bull Case Scenario,10/22/19
2,"BetterInvesting 100 Index Grows 10.4% Annually for 5 Years, 13.4% for 10 Years Through September",10/18/19
2,Cisco Nominates Carol B. Tomé to Board of Directors,10/17/19
2,Canary Wharf Group and Cisco announce deployment of OpenRoaming,10/31/19
2,Hollywood Park Partners With Cisco To Create World-Class Technology Showcase,10/31/19
2,"Zoom: Great Company, Valuation Still In Fantasy Land",10/22/19
2,"Cisco Research Shows IT Eager to Adopt Artificial Intelligence, Intent-based Networking",10/24/19
2,Here’s how much Corporate America’s paying in taxes after Trump’s cuts,10/30/19
2,Doubling The Market's Result With The Safest Stocks,10/16/19
2,Micron: Watch For Big Upside In Server Growth From Customers This Quarter,10/18/19
2,Gogo Announces Partners For 5G Network and Onboard Systems,10/22/19
2,"Танкеры для завода ""Ямал СПГ"" освободили от санкций США",10/22/19
2,"Cisco Research Shows IT Eager to Adopt Artificial Intelligence, Intent-based Networking",10/24/19
2,"Cloud Names Are Getting Hammered, Buy Them Or Look At Other Sectors, Yes And Yes",10/16/19
2,"Atlassian Earnings: Solid Quarter, Bad Timing Summary",10/22/19
2,"Atlassian Earnings: Solid Quarter, Bad Timing",10/22/19
2,推动诊疗提高生存率 他们都为乳癌诊治而忙碌,10/16/19
2,Quarterly Review Of DivGro: Q3 2019,10/23/19
2,Dividend Challenger Highlights: Week Of October 20,10/19/19
2,"Cisco Touts KDDI, Telenor, Telefonica 5G Deployments",10/21/19
2,"Microsoft Azure And Amazon AWS Results Will Inform Us On Tech Rally, Boeing Is Still A Buy",10/21/19
2,The Most Dangerous Dividend Stocks You Can Buy This Earnings Season,10/31/19
2,"As Chevron (CVX) Stock Price Rose, Bowen Hanes & Co Increased by $1.28 Million Its Stake; As Apple (AAPL) Market Valuation Rose, Lucas Capital Management Has Decreased Position - MЕSА Wееkly",10/18/19
2,“乡村医生”淋巴瘤科普公益行项目北川站举行,10/22/19
3,LIVE: Here come Microsoft's earnings (MSFT),10/23/19
3,Microsoft CEO Satya Nadella made $42.9 million in its last fiscal year — up 65% from the year before (MSFT),10/16/19
3,"Trump reportedly tried to stop Amazon from winning a $10 billion cloud deal, but experts say Microsoft won on its own merits (AMZN, MSFT)",10/29/19
3,"Microsoft and Amazon are showing slowdowns in their all-important cloud businesses — but Wall Street says there's far more to the story (AMZN, MSFT)",10/25/19
3,"Microsoft's $10 billion Pentagon cloud contract win is a clear sign it's in the same league as Amazon Web Services, but experts say the fight isn't finished yet (MSFT, AMZN)",10/29/19
3,"It looks like Amazon is moving into a massive new tower that the late Microsoft cofounder Paul Allen's company is building in the Seattle suburb where Jeff Bezos started it all (AMZN, MSFT)",10/30/19
3,MSFT Events app gets updated ahead of Microsoft Ignite,10/24/19
3,Microsoft Corp (MSFT) Q1 2020 Earnings Call Transcript,10/24/19
3,The Number One: FAANG companies’ employees donate most often to this presidential candidate,10/31/19
3,Microsoft’s Challenge of Amazon in the Cloud Gains Force - The Wall Street Journal,10/27/19
3,"The Ratings Game: Microsoft earnings show company can ‘weather any storm,’ analyst says",10/24/19
3,The Ratings Game: Microsoft wins JEDI battle but Amazon could return fire,10/28/19
3,"Tech Roundup: AMZN Misses, MSFT Tops, INTC Is the Biggest Surprise - Yahoo Finance",10/25/19
3,"In One Chart: Facebook, Visa among the stocks with high ESG marks — enough to outrun the S&P 500",10/18/19
3,"Momentum investors are now buying shares of Apple, Amazon and Netflix",10/15/19
3,Microsoft to announce Q1 2020 earnings,10/23/19
3,Microsoft (MSFT) to Report Q1 Earnings: What to Expect?,10/18/19
3,"Going Into Earnings, Microsoft Stock Is a Buy",10/18/19
3,The Force is with Microsoft: Shares up on winning JEDI contract,10/28/19
3,Will Microsoft's (MSFT) Cloud Segment Drive Its Q1 Earnings?,10/21/19
3,"Microsoft, Nuance Team Up to Accelerate Healthcare Delivery",10/18/19
3,"Microsoft has a massive opportunity to overtake Amazon Web Services thanks to the strength of its hybrid cloud business, analysts say (MSFT)",10/24/19
3,"Microsoft is bringing back its all-inclusive Xbox One subscription deal, and it includes an upgrade plan for the next-generation Xbox (MSFT)",10/28/19
3,"SAP's co-CEO and Microsoft's sales chief explain why they're teaming up for a cloud partnership that could mean trouble for Amazon (MSFT, SAP)",10/21/19
3,Microsoft Corp. (MSFT) CEO Satya Nadella on Q1 2020 Results - Earnings Call Transcript,10/24/19
3,Why the Earnings Surprise Streak Could Continue for Microsoft (MSFT),10/21/19
3,"5 Top Stock Trades for Monday: BA, MSFT, JNJ, SNAP, AXP",10/18/19
3,"The Ratings Game: Cloud software stocks slammed amid Workday fears, Morgan Stanley doubts",10/16/19
3,"Earnings Watch: Boeing, Caterpillar report disappointing earnings, but their shares bounce back",10/23/19
3,Outside the Box: Here’s what to watch in the Microsoft vs. Amazon cloud battle after JEDI win,10/28/19
3,Microsoft’s Break Out May Send Shares Surging Higher,10/28/19
3,The Ratings Game: Chip-equipment companies suggest a recovery is on the way,10/31/19
3,Microsoft Earnings Preview: Buy MSFT Stock on Cloud Computing Growth?,10/17/19
3,Microsoft (MSFT) Q1 Earnings and Revenues Top Estimates,10/23/19
3,Wall Street Looks For Direction Amid Mixed Earnings Results,10/23/19
3,"Tech Stocks' Earnings Roster for Oct 23: MSFT, XLNX & More - Yahoo Finance",10/22/19
3,"The Force Is With Microsoft; Apple Might Be Cooked For Now, Let's Chart It",10/27/19
3,Apple supera Microsoft é mais uma vez a empresa mais valiosa do mundo,10/19/19
3,"We're Just Points From An S&P Breakout, And Strong Results From Microsoft, ServiceNow, And PayPal Will Boost Cloud Names",10/24/19
3,"Earnings Get Even Busier As More Than 40 Companies Report Today, Including Amazon",10/24/19
3,Tech Stocks Drive the S&P 500 to Record Highs - Market Realist,10/29/19
3,Rex Nutting: The super rich elite have more money than they know what to do with,10/28/19
3,The total market index isn’t all it’s cracked up to be,10/21/19
3,"Earnings Watch: Tesla speeds toward unpleasant earnings turn, Boeing faces tough questions",10/20/19
3,"Eurozone Fears, CAT, MSFT & TSLA Earnings & Buy Callaway Stock - Free Lunch",10/24/19
3,9 ETFs to Buy Now for Growth,10/30/19
3,Microsoft (MSFT) Prepares To Release Earnings: Can It Remain The Cloud King?,10/22/19
3,Earnings Outlook: Microsoft earnings: The death of Windows 7 is almost here,10/22/19
3,Microsoft Stock Poised To Break Out On JEDI Contract Win - Investor's Business Daily,10/28/19
3,How Stock Market Indices Are Taking Cues from Microsoft,10/28/19
3,【世界経済を知る】増収増益、連続増配ハイテク米国株銘柄マイクロソフト【MSFT】 - 日本の投資家AFURO KENブログ,10/18/19
3,3 Tech Stocks to Buy After the Nasdaq Breakout - Investorplace.com,10/28/19
3,Ações da Apple batem novo recorde; Alphabet passa Amazon e se torna a 3ª empresa mais valiosa,10/23/19
3,Microsoft Trades Higher On $10B Cloud Computing Deal With Pentagon,10/28/19
3,5 Amazing Big Tech Earnings Charts - Zacks.com,10/22/19
3,Is Amazon Stock Ready to Break Out Again?,10/15/19
3,Microsoft Just Won a $10 Billion Defense Cloud Contract,10/28/19
3,6 Stocks to Buy for Their Massive Stock Buybacks,10/30/19
3,"Andrew Yang at Democratic debate: No one uses Bing. ‘Sorry, Microsoft, it’s true.’ - NJ.com",10/16/19
3,5 Amazing Big Tech Earnings Charts,10/22/19
3,"Ações da Apple abrem a semana em nova alta histórica, valendo agora US$249,05",10/28/19
3,"Apple surpasses Microsoft as the world’s most valuable company (AAPL, MSFT)",10/18/19
3,Microsoft Set to Beat Estimates: ETFs to Buy,10/21/19
3,Are Women Better Stock Investors?,10/23/19
3,Tech Stocks for Dividend Investors to Buy as Q3 Earnings Season Heats Up,10/16/19
3,5 Amazing Big Tech Earnings Charts - Nasdaq,10/22/19
3,Microsoft As The One Stock To Rule Them All,10/25/19
3,Software sees green after MSFT print,10/24/19
3,"France, Germany cloud push rivals AMZN, MSFT",10/29/19
3,"Microsoft: i conti volano con Office e cloud, in calo Surface e gaming",10/24/19
3,"MSFT, ORCL, VMW most defensible stocks - BMO",10/18/19
3,"""Digital"" Gains in Real Estate",10/22/19
3,Microsoft Reports Good Results and Mixed Guidance,10/23/19
3,"Microsoft's booming cloud business could send the stock soaring 15% over the next year, RBC says (MSFT)",10/18/19
3,Microsoft CEO Satya Nadella lays out the technologies he’s betting on to take it past its $1 trillion valuation (MSFT),10/24/19
3,CenturyLink Augments Network Connectivity to Google Cloud,10/16/19
3,"Amazon AWS Selected by Old Mutual, Expands Cloud Clientele",10/18/19
3,"The Zacks Analyst Blog Highlights: Verizon, Microsoft and Cisco Systems",10/17/19
3,"Manufacturing & Retail Worries, Brexit, Q3 Earnings & Buy Google Stock - Free Lunch",10/17/19
3,"S&P 500 at New Highs, Rate Cut, Tech Earnings & Buy BURL Stock - Free Lunch",10/29/19
3,What to watch in Microsoft's Q1,10/23/19
3,"Nuance, Microsoft automating clinical documentation",10/17/19
3,Microsoft forecasts Q2 Intelligent Cloud strength,10/23/19
3,How the U.S. Trade War With China Might Affect Sony,10/24/19
3,"The Zacks Analyst Blog Highlights: Facebook, International Business Machines, Microsoft, SAP and Accenture - Nasdaq",10/16/19
3,David Rolfe’s Wedgewood Sells Longtime Holding Berkshire Hathaway,10/17/19
3,Microsoft Sees Few Clouds on Tech Horizon - The Wall Street Journal,10/24/19
3,S&P 500: Tech Stocks Could Lead Decline Today - Market Realist,10/23/19
3,Microsoft Stock Approaches Buy Point On Post-Earnings Buzz - Investor's Business Daily,10/25/19
3,Amazon may seek cloud rematch with Microsoft and the Pentagon - Fox Business,10/28/19
3,Dow Jones Flashes Bullish Signal; Alphabet Rallies Ahead Of Earnings - Investor's Business Daily,10/28/19
3,Daily Insider Ratings Round Up 10/28/19,10/30/19
3,EU data watchdog raises Microsoft concerns,10/21/19
3,Don't count Amazon out on JEDI contract- Cowen,10/28/19
3,Microsoft is a cloud story: analyst - Yahoo Finance,10/23/19
3,Microsoft acquires Mover,10/21/19
3,Apple shares hit new all-time intraday high,10/22/19
3,Apple shares hit new all-time intraday and closing highs,10/21/19
3,Apple shares hit new all-time intraday and closing highs,10/25/19
3,Apple shares hit new all-time intraday and closing highs,10/24/19
4,Wall Street is souring on Netflix ahead of earnings. Here's why 6 firms have cut their price targets in recent weeks. (NFLX),10/16/19
4,Netflix Inc (NFLX) Q3 2019 Earnings Call Transcript,10/17/19
4,The Number One: FAANG companies’ employees donate most often to this presidential candidate,10/31/19
4,Netflix says new competition from Apple and Disney might actually help its business,10/16/19
4,Benioff & Weiss drop out of ‘Star Wars’ trilogy and HBO nixes ‘Game of Thrones’ prequel series,10/29/19
4,Stranger Things fans are flocking to buy this item,10/16/19
4,LIVE: Netflix reports Q3 earnings as Wall Street braces for another miss on subscriber growth (NFLX),10/16/19
4,This chart shows how much Brexit matters to the U.S. stock market,10/17/19
4,Need to Know: The S&P 500 may be ‘one decent day of gains’ away from a ‘breakout’,10/16/19
4,"The Ratings Game: Apple’s battle with Netflix won’t hurt profit despite free offer and content costs, Morgan Stanley says",10/23/19
4,Netflix to sell another $2 billion of junk bonds as it braces for onslaught of competition,10/21/19
4,Netflix Earnings Preview,10/15/19
4,"Momentum investors are now buying shares of Apple, Amazon and Netflix",10/15/19
4,Meg Whitman’s new venture is thinking big with a short-form streaming service,10/22/19
4,Netflix: The Best Days Are Over,10/17/19
4,"Netflix is 'the Mercedes-Benz, it's the Rolex' of streaming: analyst",10/16/19
4,Netflix Stock Chart and Earnings Preview,10/16/19
4,Netflix (NFLX) Surpasses Q3 Earnings Estimates,10/16/19
4,What's Next for Netflix Stock After Q3 Earnings as Apple & Disney Launch?,10/18/19
4,Actualité : Netflix passe la barre des 151 millions d'abonnés et rassure les actionnaires,10/17/19
4,"Netflix admitted price hikes hurt growth in the US, and its pricing power will face an even greater test as new rivals launch (NFLX)",10/18/19
4,What's in the Offing for Netflix (NFLX) in Q3 Earnings?,10/15/19
4,MarketWatch First Take: Netflix finally admits the obvious: Competition from Apple and Disney will hurt,10/16/19
